name,city,state,country,position,type,designation,images,website,description,radius
North York Moors and Yorkshire Dales Dark Sky Festival,"The Old Vicarage, Bondgate, Helmsley, York",North Yorkshire,United Kingdom,"[ -0.892714, 54.38716]",Festival,,{},https://www.northyorkmoors.org.uk/visiting/whats-on/dark-skies-festival,,50000
Exmoor Dark Skies Festival,Dulverton,Somerset,United Kingdom,"[ -3.552937, 51.040565]",Festival,,{},https://www.exmoor-nationalpark.gov.uk/enjoying/stargazing/dark-skies-festival,,50000
Mayo Dark Sky Park,Ballycroy Village,County Mayo ,Ireland,"[ -9.8233278, 54.0244585]",Park,,{},http://www.mayodarkskypark.ie/,,50000
Joshua Tree Dark Sky Festival,Twentynine Palms,California,United States,"[ -116.2248103, 34.1646533 ]",Festival,,{},https://www.skysthelimit29.org/night-sky-festival.html,,50000
Thebacha & Wood Buffalo Dark Festival,Fort Smith,Northwest Territory,Canada,"[-112.8764021, 59.4395031 ]",Festival,,{},https://www.tawbas.ca/dark-sky-festival.html,,50000
East Sierra Dark Sky Festival,Mammoth Lakes,California,United States,"[-119.0880253, 37.6197082 ]",Festival,,{},https://www.easternsierraobservatory.com/eastern-sierra-dark-sky-festival,,50000
Qaleraliq Glacier camp/Tasiusaq Hostel,,,Greenland,"[-44.819722, 60.193056 ]",N/A,,{},https://visitgreenland.com/about-greenland/northern-lights/,,50000
